[
  {
    "class": "normal",
    "commit": 0,
    "eid": "e0",
    "event": "e0",
    "owner": "agent",
    "payload": {
      "acceptance": [
        "human-review"
      ],
      "actions": [
        "run-check"
      ],
      "evidence_ids": [
        "u1"
      ],
      "frame_id": "p1",
      "goal": "investigate a bounded anomaly",
      "kind": "Frame",
      "risk_ids": [
        "r1"
      ],
      "scope": "agent-demo"
    },
    "slot": "0",
    "version": 1,
    "writer": "agent"
  },
  {
    "class": "normal",
    "commit": 1,
    "eid": "e1",
    "event": "e1",
    "owner": "agent",
    "payload": {
      "digest": "sha256:source",
      "evidence_id": "u1",
      "kind": "Evidence"
    },
    "slot": "0",
    "version": 1,
    "writer": "agent"
  },
  {
    "class": "normal",
    "commit": 2,
    "eid": "e2",
    "event": "e2",
    "owner": "agent",
    "payload": {
      "cert_id": "c-risk",
      "expires_at": 99,
      "family": "risk",
        "family_check": {
          "accepted": true,
          "assumption": "CertificateFamilyChecker",
          "checked_at": 2,
          "checker": "example-certificate-family-v1",
        "dependency_digest": "sha256:6dc416ab067f207d6c485f2dc657efb8587b03e29676982cdc9d239a627564f2",
        "revocation_frontier": [],
        "transcript_digest": "sha256:c6eb3ce40abe6b7d35e77c5494d579d7de737871da0c5be57aa1fa6a4f323b51"
      },
      "issuer": "agent",
      "kind": "Issue"
    },
    "slot": "0",
    "version": 1,
    "writer": "agent"
  },
  {
    "class": "normal",
    "commit": 3,
    "eid": "e3",
    "event": "e3",
    "owner": "agent",
    "payload": {
      "frame_id": "p1",
      "kind": "Activated"
    },
    "slot": "0",
    "version": 1,
    "writer": "agent"
  },
  {
    "class": "normal",
    "commit": 4,
    "eid": "e4",
    "event": "e4",
    "owner": "agent",
    "payload": {
      "family": "fixed",
      "hypothesis_id": "h1",
      "kind": "RiskReg"
    },
    "slot": "0",
    "version": 1,
    "writer": "agent"
  },
  {
    "class": "normal",
    "commit": 5,
    "eid": "e5",
    "event": "e5",
    "owner": "agent",
    "payload": {
      "eta": "1/100",
      "frame_id": "p1",
      "hypothesis_id": "h1",
      "kind": "RiskReserve",
      "risk_id": "r1"
    },
    "slot": "0",
    "version": 1,
    "writer": "agent"
  },
  {
    "class": "normal",
    "commit": 6,
    "eid": "e6",
    "event": "e6",
    "owner": "agent",
    "payload": {
      "cert_id": "c-risk",
      "eta": "1/100",
      "frame_id": "p1",
      "hypothesis_id": "h1",
      "kind": "RiskSpend",
      "mode": "fixed",
      "risk_id": "r1"
    },
    "slot": "0",
    "version": 1,
    "writer": "agent"
  },
  {
    "class": "normal",
    "commit": 7,
    "eid": "e7",
    "event": "e7",
    "owner": "agent",
    "payload": {
      "frame_id": "p1",
      "kind": "ReserveResource",
      "lease_id": "lease1",
      "token_id": "tool"
    },
    "slot": "0",
    "version": 1,
    "writer": "agent"
  },
  {
    "class": "normal",
    "commit": 8,
    "eid": "e8",
    "event": "e8",
    "owner": "agent",
    "payload": {
      "action": "run-check",
      "capability_id": "cap1",
      "frame_id": "p1",
      "kind": "MintCap"
    },
    "slot": "0",
    "version": 1,
    "writer": "agent"
  },
  {
    "class": "normal",
    "commit": 9,
    "eid": "e9",
    "event": "e9",
    "owner": "agent",
    "payload": {
      "action": "run-check",
      "frame_id": "p1",
      "kind": "AuthorizeOutbox",
      "outbox_id": "out1"
    },
    "slot": "0",
    "version": 1,
    "writer": "agent"
  }
]
